<?xml version="1.0" encoding="UTF-8"?> 
<oval_variables xmlns="http://oval.mitre.org/XMLSchema/oval-variables-5" 
    xmlns:oval="http://oval.mitre.org/XMLSchema/oval-common-5" 
    xmlns:xsi="http://www.w3.org/2001/XMLSchema-instance" 
    xsi:schemaLocation="http://oval.mitre.org/XMLSchema/oval-variables-5 oval-variables-schema.xsd http://oval.mitre.org/XMLSchema/oval-common-5 oval-common-schema.xsd"> 
    <generator> 
      <oval:schema_version>5.10.1</oval:schema_version> 
      <oval:timestamp>2006-09-18T15:24:29.903-04:00</oval:timestamp> 
      <terms_of_use>Copyright (c) 2002-2012, The MITRE Corporation. All rights reserved. The contents of this file are subject to the license described in terms.txt.</terms_of_use>
    </generator> 
    <variables> 
        <variable id="oval:org.mitre.oval.test:var:566" datatype="binary" comment="This variable represents the binary value '0000'"> 
            <value>0000</value>
        </variable> 
        <variable id="oval:org.mitre.oval.test:var:505" datatype="binary" comment="This variable represents the binary values '0000', '0010', '0100', and '1000'."> 
            <value>0000</value>
            <value>0010</value>
            <value>0100</value>
            <value>1000</value>
        </variable>
        <variable id="oval:org.mitre.oval.test:var:453" datatype="boolean" comment="This variable represents the boolean value 'true'"> 
            <value>true</value>
        </variable> 
        <variable id="oval:org.mitre.oval.test:var:983" datatype="boolean" comment="This variable represents the boolean values 'true', 'false', '0', and '1'."> 
            <value>true</value>
            <value>false</value>
            <value>0</value>
            <value>1</value>
        </variable>
        <variable id="oval:org.mitre.oval.test:var:89" datatype="evr_string" comment="This variable represents the evr_string value '1:2.3.4-5.6'."> 
            <value>1:2.3.4-5.6</value>
        </variable> 
        <variable id="oval:org.mitre.oval.test:var:51" datatype="evr_string" comment="This variable represents the evr_string values '1:2.3.4-5.6', '1:2.3.4-5.7', '1:2.3.4-5.8', and '1:2.3.4-5.9'."> 
            <value>1:2.3.4-5.6</value>
            <value>1:2.3.4-5.7</value>
            <value>1:2.3.4-5.8</value>
            <value>1:2.3.4-5.9</value>
        </variable>
        <variable id="oval:org.mitre.oval.test:var:592" datatype="float" comment="This variable represents the float value '1.23456'."> 
            <value>1.23456</value>
        </variable> 
        <variable id="oval:org.mitre.oval.test:var:964" datatype="float" comment="This variable represents the float values '1.23456', '-3.542E2', '100e-4', '-.4323e-3'."> 
            <value>1.23456</value>
            <value>-3.542E2</value>
            <value>100e-4</value>
            <value>-.4323e-3</value>
        </variable>
        <variable id="oval:org.mitre.oval.test:var:621" datatype="int" comment="This variable represents the integer value '0'."> 
            <value>0</value>
        </variable> 
        <variable id="oval:org.mitre.oval.test:var:199" datatype="int" comment="This variable represents the integer values '0', '-35422', '1004', and '-43233'."> 
            <value>0</value>
            <value>-35422</value>
            <value>1004</value>
            <value>-43233</value>
        </variable>
        <variable id="oval:org.mitre.oval.test:var:183" datatype="string" comment="This variable represents the string value 'test_string_1'."> 
            <value>test_string_1</value>
        </variable> 
        <variable id="oval:org.mitre.oval.test:var:86" datatype="string" comment="This variable represents the string values 'test_string_1', 'test_string_2', 'test_string_3', and 'test_string_4'."> 
            <value>test_string_1</value>
            <value>test_string_2</value>
            <value>test_string_3</value>
            <value>test_string_4</value>
        </variable>
        <variable id="oval:org.mitre.oval.test:var:110" datatype="version" comment="This variable represents the version value '1.2.3.4'."> 
            <value>1.2.3.4</value>
        </variable> 
        <variable id="oval:org.mitre.oval.test:var:215" datatype="version" comment="This variable represents the version values '1.2.3.4', '1a2s3d4', '1.2.3-04', and '1.2+3.4'."> 
            <value>1.2.3.4</value>
            <value>1a2s3d4</value>
            <value>1.2.3-04</value>
            <value>1.2+3.4</value>
        </variable>
        <variable id="oval:org.mitre.oval.test:var:629" datatype="string" comment="This variable represents the string value '123-456-7890'."> 
            <value>123-456-7890</value>
        </variable> 
        <variable id="oval:org.mitre.oval.test:var:327" datatype="string" comment="This variable represents the string value '1-123-456-7890'."> 
            <value>1-123-456-7890</value>
        </variable> 
        <variable id="oval:org.mitre.oval.test:var:642" datatype="int" comment="This variable represents the integer value '0'."> 
            <value>0</value>
        </variable> 
        <variable id="oval:org.mitre.oval.test:var:863" datatype="int" comment="This variable represents the integer value '1'."> 
            <value>1</value>
        </variable> 
    </variables> 
</oval_variables> 
