<?xml version="1.0" encoding="UTF-8"?>
<oval_variables xmlns="http://oval.mitre.org/XMLSchema/oval-variables-5"
    xmlns:oval="http://oval.mitre.org/XMLSchema/oval-common-5"
    xmlns:xsi="http://www.w3.org/2001/XMLSchema-instance"
    xsi:schemaLocation="http://oval.mitre.org/XMLSchema/oval-variables-5 oval-variables-schema.xsd http://oval.mitre.org/XMLSchema/oval-common-5 oval-common-schema.xsd">
    <generator>
      <oval:schema_version>5.11</oval:schema_version>
      <oval:timestamp>2015-06-12T15:24:29.903-04:00</oval:timestamp>
    </generator>
    <variables>
        <variable id="oval:x:var:1" datatype="int" comment="This variable represents the integer value '1'.">
            <value>1</value>
        </variable>
        <variable id="oval:x:var:2" datatype="int" comment="This variable represents the integer value '1'.">
            <value>1</value>
        </variable>
        <variable id="oval:x:var:3" datatype="int" comment="This variable represents the integer value '1'.">
            <value>1</value>
        </variable>
        <variable id="oval:x:var:4" datatype="int" comment="This variable represents the integer value '1'.">
            <value>1</value>
        </variable>
    </variables>
</oval_variables>
